{
  "schema": "afi.analyst-strategy-registration.v1",
  "analystId": "froggy",
  "strategyId": "trend_pullback_v1",
  "strategyVersion": "1.0.0",
  "analystConfigHash": {
    "algorithm": "sha256",
    "canonicalizationVersion": "afi.hash.v1",
    "domainTag": "afi.d2.analyst-config",
    "value": "300783e4f93ae07b2d758a3780b03cfbf6e4742bb4e0e5c9e06fb54c1df1ff99"
  },
  "configRef": "afi-config/registries/analyst-strategies/froggy--trend_pullback_v1--1.0.0.config.json",
  "providerBindingPolicy": {
    "mode": "explicit",
    "allowedBindings": [
      "tradingview-default-webhook",
      "gateway-tenant-a",
      "cpj-oracle-telegram-channel-1",
      "cpj-oracle-telegram-channel-2",
      "cpj-oracle-discord-guild-3"
    ]
  },
  "status": "active",
  "registeredAt": "2026-07-18",
  "registrationRef": "AFI-Protocol/afi-config PR (branch mission/evidence-v3-provider-provenance-v0.1): owner-authorized composition-pin re-record onto pipeline v1.3.0 (all-five fail-fast category lanes) per evidence-v3-provider-provenance-v0.1 D-EV3-5(1), five-lane-provider-runtime-v0.1 D-FLPR-5(5), factory-configurable-pipelines-v1 D-FCP-5"
}
